test_case,description,valid_json,raw_json,schedule_feasibility,dependency_accuracy,resource_balance,time_utilization,effort_accuracy,coverage,output_coherence,scalability,time_total
1,Simple 3-task linear dependency,False,,0.0,0.0,0.0,0.0,0.0,0.0,0.0,0.0,640.3741345405579
2,Parallel tasks with shared resources,False,,0.0,0.0,0.0,0.0,0.0,0.0,0.0,0.0,4.355713367462158
3,Overbooked team member,False,,0.0,0.0,0.0,0.0,0.0,0.0,0.0,0.0,0.5829424858093262
4,Tasks without assigned member (model decides),False,,0.0,0.0,0.0,0.0,0.0,0.0,0.0,0.0,0.3580470085144043
5,Complex web with multiple dependencies,False,,0.0,0.0,0.0,0.0,0.0,0.0,0.0,0.0,0.38974857330322266
